{
  "adr_id": "0007-workflow-packs",
  "title": "Workflow packs over domain-specific core",
  "status": "accepted",
  "decision": "Legal and other workflows are declarative packs, not hardcoded product identity.",
  "consequences": [
    "Implementation agents must respect this decision unless an RFC supersedes it."
  ]
}