{
  "adr_id": "0010-feature-flags-frontier",
  "title": "Feature flags and frontier lanes",
  "status": "accepted",
  "decision": "Frontier features are feature-gated and evidence-gated before default enablement.",
  "consequences": [
    "Implementation agents must respect this decision unless an RFC supersedes it."
  ]
}