{
  "adr_id": "0008-fork-policy-upstream-first",
  "title": "Upstream-first dependency policy",
  "status": "accepted",
  "decision": "Forks are temporary and require owner, reason, rebase cadence and exit criteria.",
  "consequences": [
    "Implementation agents must respect this decision unless an RFC supersedes it."
  ]
}