{
  "adr_id": "0002-operation-intent-patch-plan-receipt",
  "title": "Operation pipeline",
  "status": "accepted",
  "decision": "Destructive operations flow through intent, patch plan, review/policy, apply, verify and receipt.",
  "consequences": [
    "Implementation agents must respect this decision unless an RFC supersedes it."
  ]
}